,Word,Lemma,POS,Case,Number,Person,Tense,Mood,Voice,Form-Lemma Difference,Subtokens,Subtoken IDs,Subtoken Start Index,Subtoken End Index,Target Class,BERT Subtokenized Sentence,Sentence
22249,breyers,breyer,NOUN,,Plur,,,,,1,"['br', '##eyer', '##s']","[7987, 20211, 2015]",1,3,Plural Noun,my br ##eyer ##s need stables or barns though . . . . . and i need directions and materials on how to make them .,My breyers need stables or barns though ..... and I need directions and materials on how to make them .
22269,stalls,stall,NOUN,,Plur,,,,,1,['stalls'],[19753],4,4,Plural Noun,"figure out how many stalls you want , then measure square cube sections for length and width of horse ,","figure out how many stalls you want , then measure square cube sections for length and width of horse ,"
22289,shops,shop,NOUN,,Plur,,,,,1,['shops'],[7340],2,2,Plural Noun,"check hobby shops and craft shops for small pieces of stock wood panels and wood blocks parts , you want carpenter wood glue , cl ##amps , possibly small screw ##s to hold corners together , miniature hinges , tape , paint , saw ##s , drills , pencil ruler , paper , br ##yer horses","check hobby shops and craft shops for small pieces of stock wood panels and wood blocks parts , you want carpenter wood glue , clamps , possibly small screws to hold corners together , miniature hinges , tape , paint , saws , drills , pencil ruler , paper , bryer horses"
22341,seems,seem,VERB,,Sing,3,Pres,,,1,['seems'],[3849],1,1,Third-Person Present Tense Verb,that seems cruel to me though .,That seems cruel to me though .
22348,for,for,ADP,,,,,,,0,['for'],[2005],4,4,Causal-Final Case,this one is better for rats .,This one is better for rats .
22355,for,for,ADP,,,,,,,0,['for'],[2005],9,9,Causal-Final Case,you always want to go higher rather than wider for rats .,You always want to go higher rather than wider for rats .
22367,cages,cage,NOUN,,Plur,,,,,1,['cages'],[27157],5,5,Plural Noun,"i used one of these cages short term for a pet and it was n ' t that great to be honest , pretty cheap ##ly made , the door springs are annoying and it does n ' t last very well .","I used one of these cages short term for a pet and it was n't that great to be honest , pretty cheaply made , the door springs are annoying and it does n't last very well ."
22443,names,name,NOUN,,Plur,,,,,1,['names'],[3415],17,17,Plural Noun,these are all a bit more expensive than your choice but if you e ##bay search the names you may be able to find one second hand . . . better paying for a second hand one in good condition than a poorly made new one im ##o .,These are all a bit more expensive than your choice but if you ebay search the names you may be able to find one second hand ... better paying for a second hand one in good condition than a poorly made new one IMO .
22488,for,for,ADP,,,,,,,0,['for'],[2005],9,9,Causal-Final Case,is under tank heating or side tank heating better for a corn snake ?,is under tank heating or side tank heating better for a corn snake ?
22502,for,for,ADP,,,,,,,0,['for'],[2005],11,11,Causal-Final Case,i now use a 75 watt bas ##king or heat bulb for mine and he seems to like it,I now use a 75 watt basking or heat bulb for mine and he seems to like it
22520,for,for,ADP,,,,,,,0,['for'],[2005],6,6,Causal-Final Case,unless you plan on being late for the br ##idal shower you might want to post this again in the l . a . section .,Unless you plan on being late for the bridal shower you might want to post this again in the L.A. section .
22542,for,for,ADP,,,,,,,0,['for'],[2005],9,9,Causal-Final Case,to save money robert mcnamara ordered that the ammunition for the new m - 16 ##s being sent to sea in the early 60s use an older ( dirt ##ier ) type of gunpowder meant for use with the m - 14 .,To save money Robert McNamara ordered that the ammunition for the new M - 16s being sent to SEA in the early 60s use an older ( dirtier ) type of gunpowder meant for use with the M - 14 .
22624,troops,troop,NOUN,,Plur,,,,,1,['troops'],[3629],2,2,Plural Noun,once the troops started cleaning the weapon properly ( even with the dirt ##ier powder ) the vietnam era m - 16 turned out to be a good weapon for the purpose it was being used for .,Once the troops started cleaning the weapon properly ( even with the dirtier powder ) the Vietnam era M - 16 turned out to be a good weapon for the purpose it was being used for .
22735,waterfalls,waterfall,NOUN,,Plur,,,,,1,['waterfalls'],[24236],9,9,Plural Noun,"widely considered to be one of the most spectacular waterfalls in the world , the i ##gua ##zu falls on the border of argentina and brazil , are a certainly must see attraction in the area .","Widely considered to be one of the most spectacular waterfalls in the world , the Iguazu Falls on the border of Argentina and Brazil , are a certainly must see attraction in the area ."
22770,shots,shot,NOUN,,Plur,,,,,1,['shots'],[7171],6,6,Plural Noun,"however , save some of your shots for the rest of the falls , as in total there are around 270 cascade ##s that spread out over nearly 2 miles of the i ##gua ##zu river .","However , save some of your shots for the rest of the falls , as in total there are around 270 cascades that spread out over nearly 2 miles of the Iguazu River ."
22804,restrictions,restriction,NOUN,,Plur,,,,,1,['restrictions'],[9259],14,14,Plural Noun,"the i ##gua ##zu falls are easily accessible and , dependent on your time restrictions and budget , you can get to the area by either bus or plane .","The Iguazu Falls are easily accessible and , dependent on your time restrictions and budget , you can get to the area by either bus or plane ."
22832,for,for,ADP,,,,,,,0,['for'],[2005],18,18,Causal-Final Case,"f ##oz on the brazilian side is the larger town , however both are geared up to cater for visitors to the waterfalls and national parks , and so offer a range of accommodation for all budgets .","Foz on the Brazilian side is the larger town , however both are geared up to cater for visitors to the Waterfalls and National Parks , and so offer a range of accommodation for all budgets ."
22906,'s,be,AUX,,Sing,3,Pres,Ind,,0,"[""'"", 's']","[1005, 1055]",11,12,Genitive Case,"the difference is what they need to live , vs what ' s ideal for them .","The difference is what they need to live , VS what 's ideal for them ."
22922,stops,stop,VERB,,Sing,3,Pres,,,1,['stops'],[6762],6,6,Third-Person Present Tense Verb,"when the male s aggressive behavior stops , it is ready to spawn .","When the male s aggressive behavior stops , it is ready to spawn ."
22936,degrees,degree,NOUN,,Plur,,,,,1,['degrees'],[5445],8,8,Plural Noun,turn the water te ##mp up to 82 degrees,Turn the water temp up to 82 degrees
22944,'s,be,AUX,,Sing,3,Pres,Ind,,0,"[""'"", 's']","[1005, 1055]",18,19,Genitive Case,i do n ' t have the money to take her to a vet right now but it ' s getting to be an issue .,I do n't have the money to take her to a vet right now but it 's getting to be an issue .
22990,is,be,VERB,,Sing,3,Pres,Ind,,0,['is'],[2003],2,2,Third-Person Present Tense Verb,"if there is blood in the urine , or the cat seems to be in pain , then that is also a good indicator .","If there is blood in the urine , or the cat seems to be in pain , then that is also a good indicator ."
23015,for,for,ADP,,,,,,,0,['for'],[2005],20,20,Causal-Final Case,"i know you are very worried , but getting her to the vet is the best thing you can do for her .","I know you are very worried , but getting her to the vet is the best thing you can do for her ."
23061,states,state,VERB,,Sing,3,Pres,,,1,['states'],[2163],40,40,Third-Person Present Tense Verb,"according to the citizenship and immigration canada web site at http : / / www . ci ##c . g ##c . ca / english / im ##mi ##grate / skilled / assess / index . as ##p , it states "" note : you must meet the minimum requirements for your application to be eligible for processing . ""","According to the Citizenship and Immigration Canada web site at http://www.cic.gc.ca/english/immigrate/skilled/assess/index.asp , it states "" Note : you must meet the minimum requirements for your application to be eligible for processing . """
23127,for,for,ADP,,,,,,,0,['for'],[2005],3,3,Causal-Final Case,"you should check for updated information on a regular basis . ""","You should check for updated information on a regular basis . """
23139,believes,believe,VERB,,Sing,3,Pres,,,1,['believes'],[7164],7,7,Third-Person Present Tense Verb,""" if the canadian immigration visa officer believes that the point total does not accurately reflect your ability to become economically established in canada , the canadian immigration visa officer may use his or her positive discretion ( referred to as substituted evaluation ) and approve your application even though you score less than 67 points . """,""" If the Canadian Immigration Visa Officer believes that the point total does not accurately reflect your ability to become economically established in Canada , the Canadian Immigration Visa Officer may use his or her positive discretion ( referred to as substituted evaluation ) and approve your application even though you score less than 67 points . """
23197,for,for,ADP,,,,,,,0,['for'],[2005],14,14,Causal-Final Case,"alright , so my dad had been wanting me to check my e mail for a few days but i never got around to it .","Alright , so my dad had been wanting me to check my e mail for a few days but I never got around to it ."
23223,origins,origin,NOUN,,Plur,,,,,1,['origins'],[7321],2,2,Plural Noun,"although the origins of a movement that was confined largely to the liter ##ate culture of intellectual endeavor and patronage can be traced to the earlier part of the 14th century , many aspects of italian culture and society remained largely medieval ; the renaissance did not come into full swing until the end of the century .","Although the origins of a movement that was confined largely to the literate culture of intellectual endeavor and patronage can be traced to the earlier part of the 14th century , many aspects of Italian culture and society remained largely Medieval ; the Renaissance did not come into full swing until the end of the century ."
23337,arts,art,NOUN,,Plur,,,,,1,['arts'],[2840],26,26,Plural Noun,"2 ) the expression high renaissance , in art history , is a period ##izing convention used to denote the ap ##oge ##e of the visual arts in the italian renaissance .","2 ) The expression High Renaissance , in art history , is a periodizing convention used to denote the apogee of the visual arts in the Italian Renaissance ."
23366,people,people,NOUN,,Plur,,,,,0,['people'],[2111],5,5,Plural Noun,i have talked to some people that say that a medical exam is an invasion of privacy and other say it s a routine thing when entering another country .,i have talked to some people that say that a medical exam is an invasion of privacy and other say it s a routine thing when entering another country .
23396,pics,pic,NOUN,,Plur,,,,,1,"['pic', '##s']","[27263, 2015]",4,5,Plural Noun,if you had any pic ##s of your hen ##s i would like to see them to compare them to mine thanks ?,if you had any pics of your hens i would like to see them to compare them to mine thanks ?
23417,'s,be,AUX,,Sing,3,Pres,Ind,,0,"[""'"", 's']","[1005, 1055]",9,10,Genitive Case,"my suggestion is to pay close attention to what ' s going on in the background and if possible , stand on a chair , get on the ground , do whatever you need to do to get rid of distracting elements .","My suggestion is to pay close attention to what 's going on in the background and if possible , stand on a chair , get on the ground , do whatever you need to do to get rid of distracting elements ."
23459,visitors,visitor,NOUN,,Plur,,,,,1,['visitors'],[5731],3,3,Plural Noun,"in this time visitors will come to the house , pay their respects to the des ##iste ##d and their family and have a couple of cups of tea with a sandwich or a bun .","In this time visitors will come to the house , pay their respects to the desisted and their family and have a couple of cups of tea with a sandwich or a bun ."
23493,ticks,tick,VERB,,Sing,3,Pres,,,1,"['tick', '##s']","[16356, 2015]",25,26,Third-Person Present Tense Verb,the orange order and the 12th of july marches would be argued by some not to be an irish custom but una ##rg ##ua ##ble tick ##s every criteria to be considered one .,The Orange Order and the 12th of July Marches would be argued by some not to be an Irish custom but unarguable ticks every criteria to be considered one .
23523,pictures,picture,NOUN,,Plur,,,,,1,['pictures'],[4620],4,4,Plural Noun,so they see the pictures flicker slower and there for it seems chop ##py to them .,So they see the pictures flicker slower and there for it seems choppy to them .
23539,people,people,NOUN,,Plur,,,,,0,['people'],[2111],9,9,Plural Noun,so i want to hire someone ( or multiple people ) to transport me to these shows .,So I want to hire someone ( or multiple people ) to transport me to these shows .
23557,for,for,ADP,,,,,,,0,['for'],[2005],15,15,Causal-Final Case,"impossible to say , but i guess you would have to work out fuel consumption for the particular vehicle that they are using and pay a proportion of that , and some on top for the driver ' s time and effort , unless you are able to share transport with another or more , that would keep the costs down .","Impossible to say , but I guess you would have to work out fuel consumption for the particular vehicle that they are using and pay a proportion of that , and some on top for the driver 's time and effort , unless you are able to share transport with another or more , that would keep the costs down ."
23618,rates,rate,NOUN,,Plur,,,,,1,['rates'],[6165],9,9,Plural Noun,you may be able to do better on the rates if you request competitive quotes via cruise ##com ##pet ##e ) .,You may be able to do better on the rates if you request competitive quotes via CruiseCompete ) .
23637,philipinos,philipino,NOUN,,Plur,,,,,1,"['philip', '##ino', '##s']","[5170, 5740, 2015]",6,8,Plural Noun,"as the southeast asian ##s and philip ##ino ##s came over , they added to the cultures .","As the southeast asians and philipinos came over , they added to the cultures ."
23652,for,for,ADP,,,,,,,0,['for'],[2005],11,11,Causal-Final Case,"so , the bay area has been fairly mixed ethnic ##ally for a long time - - caucasian ##s may have seemed to be a large populous but that ' s because most tourists back then were caucasian and many of the hip ##pies were caucasian ##s so that ' s who the photographers took pictures of .","So , the Bay Area has been fairly mixed ethnically for a long time -- caucasians may have seemed to be a large populous but that 's because most tourists back then were caucasian and many of the hippies were caucasians so that 's who the photographers took pictures of ."
23703,chickens,chicken,NOUN,,Plur,,,,,1,['chickens'],[21868],3,3,Plural Noun,"we feed the chickens scrap ##s of ve ##gg ##ies and fruits throughout the day , but it ' s nothing that a rabbit would n ' t be able to digest just fine .","We feed the chickens scraps of veggies and fruits throughout the day , but it 's nothing that a rabbit would n't be able to digest just fine ."
23732,for,for,ADP,,,,,,,0,['for'],[2005],12,12,Causal-Final Case,"( the rabbit hut ##ch would have an opening only big enough for the rabbit , the chickens would not be able to get to the rabbit food ) also , is it okay if the rabbit occasionally sneak ##s a few bites of chicken feed ?","( The rabbit hutch would have an opening only big enough for the rabbit , the chickens would not be able to get to the rabbit food ) Also , is it okay if the rabbit occasionally sneaks a few bites of chicken feed ?"
23822,for,for,ADP,,,,,,,0,['for'],[2005],4,4,Causal-Final Case,"pew ##ter is perfect for what you are doing , and it melt ##s on a stove top .","Pewter is perfect for what you are doing , and it melts on a stove top ."
23839,for,for,ADP,,,,,,,0,['for'],[2005],11,11,Causal-Final Case,"i bet you also did take charcoal as it is used for barbecue which does not get as hot as real coal ( e . g . for blacksmith ##ing one needs coal , not barbecue charcoal ) .","I bet you also did take charcoal as it is used for barbecue which does not get as hot as real coal ( e.g. for blacksmithing one needs coal , not barbecue charcoal ) ."
23874,s,s,VERB,,Sing,3,Pres,,,0,['s'],[1055],1,1,Third-Person Present Tense Verb,it s important to their religion that they only consume hal ##al food .,It s important to their religion that they only consume Halal food .
23887,s,s,NOUN,,Plur,,,,,0,['s'],[1055],9,9,Plural Noun,"even if you buy a cake in a baker s you can not be too what happens in the kitchen , for example the cake may have been sliced using a knife used for preparing ham .","Even if you buy a cake in a baker s you can not be too what happens in the kitchen , for example the cake may have been sliced using a knife used for preparing ham ."
23924,s,s,VERB,,Sing,3,Pres,,,0,['s'],[1055],1,1,Third-Person Present Tense Verb,"it s simply not just a case of avoiding pork , alcohol and only being allowed to eat hal ##al prepared meat , but the kitchen and its ut ##ens ##ils should not have been used for prohibited foods .","It s simply not just a case of avoiding pork , alcohol and only being allowed to eat halal prepared meat , but the kitchen and its utensils should not have been used for prohibited foods ."
23961,Places,place,NOUN,,Plur,,,,,1,['places'],[3182],0,0,Plural Noun,places like dartmouth are supposed to be tourist towns and should provide foods for people of all religions .,Places like Dartmouth are supposed to be tourist towns and should provide foods for people of all religions .
24018,parents,parent,NOUN,,Plur,,,,,1,['parents'],[3008],4,4,Plural Noun,how to convince my parents to let me get a ball python ?,How to convince my parents to let me get a Ball python ?
24031,snakes,snake,NOUN,,Plur,,,,,1,['snakes'],[12971],5,5,Plural Noun,"my wife was terrified of snakes when we first met , i introduced her to one out my baby corn snakes and she fell in love with it .","My wife was TERRIFIED of snakes when we first met , I introduced her to one out my baby corn snakes and she fell in love with it ."
24060,parents,parent,NOUN,,Plur,,,,,1,['parents'],[3008],4,4,Plural Noun,my general convince your parents to let you get a rep ##tile advice :,My general convince your parents to let you get a reptile advice :
24073,for,for,ADP,,,,,,,0,['for'],[2005],13,13,Causal-Final Case,"2 . save up , and research , so that you are ready for your new pet .","2 . Save up , and research , so that you are ready for your new pet ."
24091,needs,need,VERB,,Sing,3,Pres,,,1,['needs'],[3791],14,14,Third-Person Present Tense Verb,"if you can find a pet at a shelter , or that a friend needs to get rid of because they ' re moving or whatever , you might be able to talk your parents into "" giving it a good home "" where you might not be able to talk them into buying a new pet .","If you can find a pet at a shelter , or that a friend needs to get rid of because they 're moving or whatever , you might be able to talk your parents into "" giving it a good home "" where you might not be able to talk them into buying a new pet ."
24205,for,for,ADP,,,,,,,0,['for'],[2005],22,22,Causal-Final Case,just my opinion here - no judgement - getting your snake on frozen / tha ##wed will prove to be much easier for you and safer for your snake in the long run .,Just my opinion here - no judgement - getting your snake on frozen / thawed will prove to be much easier for you and safer for your snake in the long run .
24238,for,for,ADP,,,,,,,0,['for'],[2005],5,5,Causal-Final Case,my opinion - take it for what it ' s worth … : - ),My opinion - take it for what it 's worth … :-)
24262,reasons,reason,NOUN,,Plur,,,,,1,['reasons'],[4436],2,2,Plural Noun,"for obvious reasons , knowing how extremely difficult it is to drive a car in the city , you should probably try to be near the subway system .","For obvious reasons , knowing how extremely difficult it is to drive a car in the city , you should probably try to be near the subway system ."
24291,months,month,NOUN,,Plur,,,,,1,['months'],[2706],10,10,Plural Noun,"coming to stay , and overs ##ta ##y your three months visit will lead to immediate expulsion and a lifetime ban to im ##mi ##grate to canada - not good .","Coming to stay , and overstay your three months visit will lead to immediate expulsion and a lifetime ban to immigrate to Canada - NOT GOOD ."
24318,hundreds,hundred,NOUN,,Plur,,,,,1,['hundreds'],[5606],11,11,Plural Noun,"it is a competition , and you will be competing with hundreds of thousands of others , from all over the world , for a place in the line up .","It is a competition , and YOU will be competing with hundreds of thousands of others , from all over the world , for a place in the line up ."
24349,people,people,NOUN,,Plur,,,,,0,['people'],[2111],11,11,Plural Noun,"and every time he see some one he will rush to people and jump on them , does n ' t listen to me .","And every time he see some one he will rush to people and jump on them , does n't listen to me ."
24372,means,mean,VERB,,Sing,3,Pres,,,1,['means'],[2965],8,8,Third-Person Present Tense Verb,"try to train him to heel , which means to walk round you before he needs to go on a leash , and he may do that .","try to train him to heel , which means to walk round you before he needs to go on a leash , and he may do that ."
24400,Thanks,thank,NOUN,,Plur,,,,,1,['thanks'],[4283],0,0,Plural Noun,thanks in advance for sharing your experience !,Thanks in advance for sharing your experience !
24408,hotels,hotel,NOUN,,Plur,,,,,1,['hotels'],[9275],17,17,Plural Noun,"sorry , almost forgot to ask - would it be cheaper to walk - in to these hotels rather than pre book ?","Sorry , almost forgot to ask - Would it be cheaper to walk - in to these hotels rather than pre book ?"
24431,for,for,ADP,,,,,,,0,['for'],[2005],15,15,Causal-Final Case,to stay in agra - hotel at ##ith ##i and adi ##tya palace is perfect for you .,TO Stay in Agra - Hotel Atithi and Aditya Palace is perfect for you .
24446,Depends,depend,VERB,,Sing,3,Pres,,,1,['depends'],[9041],0,0,Third-Person Present Tense Verb,"depends on what you want in a pet , to be honest .","Depends on what you want in a pet , to be honest ."
24459,people,people,NOUN,,Plur,,,,,0,['people'],[2111],16,16,Plural Noun,my second favorite would have to be the guinea pig - not quite as social with people as rats ( at least mine was n ' t ) but more so than most ham ##sters or mice .,My second favorite would have to be the Guinea Pig - not quite as social with people as rats ( at least mine was n't ) but more so than most hamsters or mice .
24494,for,for,SCONJ,,,,,,,0,['for'],[2005],10,10,Causal-Final Case,they will whistle when they hear you as an encouragement for you to give them a treat like leaf let ##tu ##ce .,They will whistle when they hear you as an encouragement for you to give them a treat like leaf lettuce .
24515,for,for,ADP,,,,,,,0,['for'],[2005],14,14,Causal-Final Case,try to go in there with the right frame of mind and enjoy them for what they are .,Try to go in there with the right frame of mind and enjoy them for what they are .
24534,days,day,NOUN,,Plur,,,,,1,['days'],[2420],37,37,Plural Noun,i did n ' t know that i did n ' t register him in the ridiculous amount of paperwork i had filled out in the hospital and was supposed to go to city hall within 90 days .,I did n't know that I did n't register him in the ridiculous amount of paperwork I had filled out in the hospital and was supposed to go to city hall within 90 days .
24569,years,year,NOUN,,Plur,,,,,1,['years'],[2086],1,1,Plural Noun,"two years later when i got around to filling for his birth certificate , i find out he was never registered .","Two years later when I got around to filling for his birth certificate , I find out he was never registered ."
24591,copies,copy,NOUN,,Plur,,,,,2,['copies'],[4809],15,15,Plural Noun,"i had to call the office of the registrar general in thunder bay , have copies of the delayed registration form mail ##ed out to me , as they do n ' t have an online area for it yet , fill those out , send them away , then apply for his birth certificate .","I had to call the Office of the Registrar General in Thunder Bay , have copies of the delayed registration form mailed out to me , as they do n't have an online area for it yet , fill those out , send them away , then apply for his birth certificate ."
24644,people,people,NOUN,,Plur,,,,,0,['people'],[2111],9,9,Plural Noun,i add that in because there have been some people who have tried to claim citizenship by sending for their birth certificate when they were never really born in canada or to canadian parents .,I add that in because there have been some people who have tried to claim citizenship by sending for their birth certificate when they were never really born in Canada or to Canadian parents .
24679,for,for,ADP,,,,,,,0,['for'],[2005],9,9,Causal-Final Case,as long as that was done you can send for it at any time .,As long as that was done you can send for it at any time .
24694,shows,show,NOUN,,Plur,,,,,1,['shows'],[3065],5,5,Plural Noun,"if you love seeing the shows , royal caribbean was better for the main shows and carnival was slightly better for the comedians .","If you love seeing the shows , Royal Caribbean was better for the main shows and Carnival was slightly better for the comedians ."
24742,for,for,ADP,,,,,,,0,['for'],[2005],25,25,Causal-Final Case,"once you have a budget or an amount in the bank then you ' ll be able to figure out where you can go , for how long you can go and what you can do when you ' re there .","Once you have a budget or an amount in the bank then you 'll be able to figure out where you can go , for how long you can go and what you can do when you 're there ."
