,Word,Lemma,POS,Case,Number,Person,Tense,Mood,Voice,Form-Lemma Difference,Subtokens,Subtoken IDs,Subtoken Start Index,Subtoken End Index,Target Class,BERT Subtokenized Sentence,Sentence
0,members,member,NOUN,,Plur,,,,,1,['members'],[2372],30,30,Plural Noun,"the moi in iraq is equivalent to the us fbi , so this would be like having j . edgar hoover un ##wi ##tting ##ly employ at a high level members of the weather ##men bombers back in the 1960s .","The MoI in Iraq is equivalent to the US FBI , so this would be like having J. Edgar Hoover unwittingly employ at a high level members of the Weathermen bombers back in the 1960s ."
36,reminds,remind,VERB,,Sing,3,Pres,,,1,['reminds'],[15537],1,1,Third-Person Present Tense Verb,it reminds me too much of the ar ##vn officers who were secretly working for the other side in vietnam .,It reminds me too much of the ARVN officers who were secretly working for the other side in Vietnam .
56,individuals,individual,NOUN,,Plur,,,,,1,['individuals'],[3633],25,25,Plural Noun,al - za ##man : the iraqi high electoral commission on friday denied a request of the de ##ba ##athi ##fication commission to exclude 51 individuals from running on party lists in the dec . 15 elections on grounds of having been sufficiently involved in ba ##ath activities to warrant their being excluded from civil office .,Al - Zaman : The Iraqi High Electoral Commission on Friday denied a request of the Debaathification Commission to exclude 51 individuals from running on party lists in the Dec. 15 elections on grounds of having been sufficiently involved in Baath activities to warrant their being excluded from civil office .
107,people,people,NOUN,,Plur,,,,,0,['people'],[2111],8,8,Plural Noun,now the electoral commission is refusing to punish people for mere past ba ##ath party membership .,Now the Electoral Commission is refusing to punish people for mere past Baath Party membership .
123,is,be,VERB,,Sing,3,Pres,Ind,,0,['is'],[2003],8,8,Third-Person Present Tense Verb,"everyone is app ##re ##hen ##sive , there is some talk that april 9th and 10th are going to be bloody days .","Everyone is apprehensive , there is some talk that April 9th and 10th are going to be bloody days ."
143,rumours,rumour,NOUN,,Plur,,,,,1,['rumours'],[19200],2,2,Plural Noun,"there are rumours about preparations by sl ##um dwellers for another looting sp ##ree against banks , governmental and public property similar to the one that took place last april , and i have already overheard young ##sters in my neighbourhood joking about it and saying things like "" this time we will be the first to lo ##ot , we did n ' t get anything the last time "" .","There are rumours about preparations by slum dwellers for another looting spree against banks , governmental and public property similar to the one that took place last April , and I have already overheard youngsters in my neighbourhood joking about it and saying things like "" This time we will be the first to loot , we did n't get anything the last time "" ."
209,Mosques,mosque,NOUN,,Plur,,,,,1,['mosques'],[21922],0,0,Plural Noun,"mosques are calling for dona ##ting blood , food , and medicine for fall ##uj ##ah , and several convoys have already headed out for fall ##uj ##ah , most of them returned later though .","Mosques are calling for donating blood , food , and medicine for Fallujah , and several convoys have already headed out for Fallujah , most of them returned later though ."
240,for,for,ADP,,,,,,,0,['for'],[2005],17,17,Causal-Final Case,"speaking of fall ##uj ##ah , we have only al - ja ##zee ##ra to rely on for our news from there .","Speaking of Fallujah , we have only Al - Jazeera to rely on for our news from there ."
259,kinds,kind,NOUN,,Plur,,,,,1,['kinds'],[7957],21,21,Plural Noun,"they have sent over their top reporter ahmed mans ##our to the town , and he is sp ##out ##ing all kinds of propaganda hourly reminding me of al - sa ##hh ##af .","They have sent over their top reporter Ahmed Mansour to the town , and he is spouting all kinds of propaganda hourly reminding me of Al - Sahhaf ."
288,bodies,body,NOUN,,Plur,,,,,2,['bodies'],[4230],46,46,Plural Noun,"az ##zam ##an newspaper mentioned an announcement signed by abdul aziz bin mu ##q ##rin , an al - qaeda operative in saudi arabia on an islamic website ' the voice of jihad ' , in which he stated that "" although mu ##tila ##ting dead bodies is not originally permitted in islam , but in this case it is allowed if muslims use it against in ##fide ##ls to deter them from committing criminal actions "" .","Azzaman newspaper mentioned an announcement signed by Abdul Aziz bin Muqrin , an Al - Qaeda operative in Saudi Arabia on an Islamic website ' the voice of Jihad ' , in which he stated that "" although mutilating dead bodies is not originally permitted in Islam , but in this case it is allowed if Muslims use it against infidels to deter them from committing criminal actions "" ."
358,myths,myth,NOUN,,Plur,,,,,1,['myths'],[17218],5,5,Plural Noun,"one of the most widespread myths of recent times is that the cher ##nob ##yl nuclear reactor accident in 1986 caused many thousands of extra cancer deaths in neighbouring regions , and that public health has been severely affected by exposure to radiation .","One of the most widespread myths of recent times is that the Chernobyl nuclear reactor accident in 1986 caused many thousands of extra cancer deaths in neighbouring regions , and that public health has been severely affected by exposure to radiation ."
400,people,people,NOUN,,Plur,,,,,0,['people'],[2111],1,1,Plural Noun,"many people still believe that to be true , even though the ministry of russian federation on civil defence , emergencies and elimination of con ##se ##gue ##nce ##s of natural disasters ( em ##er ##com of russia ) reported this in 1996 :","Many people still believe that to be true , even though the Ministry of Russian Federation on Civil Defence , Emergencies and Elimination of Conseguences of Natural Disasters ( EMERCOM of Russia ) reported this in 1996 :"
438,regions,region,NOUN,,Plur,,,,,1,['regions'],[4655],31,31,Plural Noun,"in the last decade , there has been a real and significant increase in childhood and , to a certain extent , adult car ##cino ##ma of the thyroid in contaminated regions of the former soviet union ( wi ##9 ##40 ) which should be attributed to the cher ##nob ##yl accident until proven otherwise .","In the last decade , there has been a real and significant increase in childhood and , to a certain extent , adult carcinoma of the thyroid in contaminated regions of the former Soviet Union ( Wi940 ) which should be attributed to the Chernobyl accident until proven otherwise ."
488,folks,folk,NOUN,,Plur,,,,,1,['folks'],[12455],22,22,Plural Noun,do n ' t have to mention what radiation has done and is still doing to hi ##rso ##hima & naga ##ski folks - - there can be no doubts about the effects of radiation in cher ##nob ##yl . . . . . . .,Do n't have to mention what radiation has done and is still doing to Hirsohima & Nagaski folks -- there can be no doubts about the effects of radiation in Chernobyl .......
552,makes,make,VERB,,Sing,3,Pres,,,1,['makes'],[3084],14,14,Third-Person Present Tense Verb,"the urge to protect and gather them all in is almost overwhelming , and makes me more grateful for the blessings i have .","The urge to protect and gather them all in is almost overwhelming , and makes me more grateful for the blessings I have ."
576,figures,figure,NOUN,,Plur,,,,,1,['figures'],[4481],6,6,Plural Noun,"his military intelligence has captured major figures like abu zu ##bay ##da and khalid shay ##kh muhammad , as well as nearly 500 other al - qaeda operatives , over 400 of whom the pakistani ##s have turned over to the us .","His military intelligence has captured major figures like Abu Zubayda and Khalid Shaykh Muhammad , as well as nearly 500 other al - Qaeda operatives , over 400 of whom the Pakistanis have turned over to the US ."
615,officers,officer,NOUN,,Plur,,,,,1,['officers'],[3738],22,22,Plural Noun,"if al - qaeda can kill mu ##sha ##rra ##f or ins ##ti ##gate a military coup against him by islamist junior officers , they can hope to cat ##ap ##ult the mma to power as political allies and hosts .","If al - Qaeda can kill Musharraf or instigate a military coup against him by Islamist junior officers , they can hope to catapult the MMA to power as political allies and hosts ."
649,for,for,ADP,,,,,,,0,['for'],[2005],19,19,Causal-Final Case,"on the one hand , it should pressure mu ##sha ##rra ##f to take off his uniform and run for president in a fair election , and to repeal the contentious "" legal framework order "" that essentially per ##pet ##uate ##s his dictatorship .","On the one hand , it should pressure Musharraf to take off his uniform and run for president in a fair election , and to repeal the contentious "" Legal Framework Order "" that essentially perpetuates his dictatorship ."
688,'s,'s,PART,,,,,,,0,"[""'"", 's']","[1005, 1055]",1,2,Genitive Case,"sharon ' s hard line has worked in tandem with hamas ' s terrorism to rat ##chet up tensions further and further , which spill over into the muslim world and serve as a recruiting tool for al - qaeda in its search for agents willing to hit the united states .","Sharon 's hard line has worked in tandem with Hamas 's terrorism to ratchet up tensions further and further , which spill over into the Muslim world and serve as a recruiting tool for al - Qaeda in its search for agents willing to hit the United States ."
737,lives,life,NOUN,,Plur,,,,,1,['lives'],[3268],10,10,Plural Noun,"by moving quickly to iraqi sovereignty and improvement of iraqi lives , the us may be able to get iraqi ##s on its side , so that they turn in the foreigners .","By moving quickly to Iraqi sovereignty and improvement of Iraqi lives , the US may be able to get Iraqis on its side , so that they turn in the foreigners ."
769,lacks,lack,VERB,,Sing,3,Pres,,,1,['lacks'],[14087],9,9,Third-Person Present Tense Verb,george w . bush alleged thursday that john edwards lacks the experience necessary to be president .,George W. Bush alleged Thursday that John Edwards lacks the experience necessary to be president .
785,hoists,hoist,VERB,,Sing,3,Pres,,,1,"['ho', '##ists']","[7570, 5130]",28,29,Third-Person Present Tense Verb,"the problem with this argument is that bush lacked the experience necessary to be president when he ran in 2000 , so this sort of cheap shot just ho ##ists him by his own pet ##ard .","The problem with this argument is that Bush lacked the experience necessary to be president when he ran in 2000 , so this sort of cheap shot just hoists him by his own petard ."
820,for,for,ADP,,,,,,,0,['for'],[2005],11,11,Causal-Final Case,"texas gov . george w . bush is enduring sharp criticism for being unable to name the leaders of four current world hot spots , but president bill clinton says bush "" should , and probably will , pick up "" those names .","Texas Gov. George W. Bush is enduring sharp criticism for being unable to name the leaders of four current world hot spots , but President Bill Clinton says Bush "" should , and probably will , pick up "" those names ."
904,appears,appear,VERB,,Sing,3,Pres,,,1,['appears'],[3544],1,1,Third-Person Present Tense Verb,"it appears this guy is going to bring stability to the country and i think that ' s good news for the subcontinent . ""","It appears this guy is going to bring stability to the country and I think that 's good news for the subcontinent . """
928,Musharraf,Musharraf,NOUN,,Plur,,,,,0,"['mu', '##sha', '##rra', '##f']","[14163, 7377, 11335, 2546]",0,3,Plural Noun,"mu ##sha ##rra ##f made his coup in part because of the military ' s anger over prime minister na ##wa ##z sharif ' s willingness to back down from confronting india over kashmir , so that he explicitly came to power as a warm ##ong ##er .","Musharraf made his coup in part because of the military 's anger over Prime Minister Nawaz Sharif 's willingness to back down from confronting India over Kashmir , so that he explicitly came to power as a warmonger ."
967,'s,'s,PART,,,,,,,0,"[""'"", 's']","[1005, 1055]",19,20,Genitive Case,"i still remember him stu ##ttering about "" the general , "" unable to remember mu ##sha ##rra ##f ' s name .","I still remember him stuttering about "" the General , "" unable to remember Musharraf 's name ."
985,fighters,fighter,NOUN,,Plur,,,,,1,['fighters'],[7299],10,10,Plural Noun,"it is estimated to have some 5 , 000 armed fighters , and they have pursued attacks against israeli forces to com ##pel them to withdraw from the she ##ba ##a farms , a sl ##iver of syrian territory that israel annexed after the 1967 war .","It is estimated to have some 5,000 armed fighters , and they have pursued attacks against Israeli forces to compel them to withdraw from the Shebaa Farms , a sliver of Syrian territory that Israel annexed after the 1967 war ."
1067,families,family,NOUN,,Plur,,,,,2,['families'],[2945],17,17,Plural Noun,"although it is often alleged ( without much evidence ) that saddam hussein gave money to the families of palestinian suicide bombers and so encouraged as ##ym ##metric ##al warfare , it is not clear that he actually posed a danger to israel .","Although it is often alleged ( without much evidence ) that Saddam Hussein gave money to the families of Palestinian suicide bombers and so encouraged asymmetrical warfare , it is not clear that he actually posed a danger to Israel ."
1108,points,point,NOUN,,Plur,,,,,1,['points'],[2685],2,2,Plural Noun,"at some points , as in the late 1980s , he reportedly made behind - the - scenes overture ##s to the israelis to arrive at some sort of a deal .","At some points , as in the late 1980s , he reportedly made behind - the - scenes overtures to the Israelis to arrive at some sort of a deal ."
1139,for,for,ADP,,,,,,,0,['for'],[2005],1,1,Causal-Final Case,"worse for israel , the assassination drew a den ##unciation even from the moderate and cautious grand a ##yat ##oll ##ah ali sis ##tani , who wi ##eld ##s enormous moral authority over iraqi shi ##ites .","Worse for Israel , the assassination drew a denunciation even from the moderate and cautious Grand Ayatollah Ali Sistani , who wields enormous moral authority over Iraqi Shiites ."
1168,citizens,citizen,NOUN,,Plur,,,,,1,['citizens'],[4480],17,17,Plural Noun,"if even a mod ##icum of normal ##ity and security can be returned to iraq , its citizens will be able to benefit from the country ' s petroleum reserves .","If even a modicum of normality and security can be returned to Iraq , its citizens will be able to benefit from the country 's petroleum reserves ."
1224,into,into,ADP,,,,,,,0,['into'],[2046],8,8,Translative Case,that private wealth can easily be funnel ##ed into aid for the palestinians and for lebanese shi ##ites .,That private wealth can easily be funneled into aid for the Palestinians and for Lebanese Shiites .
1241,Tamils,tamil,NOUN,,Plur,,,,,1,"['tamil', '##s']","[6008, 2015]",0,1,Plural Noun,tamil ##s feel that the proposed defense agreement between india and sri lanka would encourage sin ##hala rulers to prepare for another war abandoning the current peace process,Tamils feel that the proposed defense agreement between India and Sri Lanka would encourage Sinhala rulers to prepare for another war abandoning the current peace process
1293,into,into,ADP,,,,,,,0,['into'],[2046],6,6,Translative Case,"while india is ready to enter into a "" defense cooperation agreement "" with sri lanka , it is wary of being drawn into any military involvement in the island nation ' s two decades - old civil war that has seen violent strife between ethnic tamil ##s and the sin ##hale ##se majority - leaving over 60 , 000 dead on both sides .","While India is ready to enter into a "" defense cooperation agreement "" with Sri Lanka , it is wary of being drawn into any military involvement in the island nation 's two decades - old civil war that has seen violent strife between ethnic Tamils and the Sinhalese majority - leaving over 60,000 dead on both sides ."
1352,'s,'s,PART,,,,,,,0,"[""'"", 's']","[1005, 1055]",11,12,Genitive Case,"for that reason , he said , kumar ##at ##ung ##a ' s government was keen to beef up military prepared ##ness with indian support .","For that reason , he said , Kumaratunga 's government was keen to beef up military preparedness with Indian support ."
1373,rebels,rebel,NOUN,,Plur,,,,,1,['rebels'],[8431],5,5,Plural Noun,"but last april , the rebels abruptly pulled out of negotiations demanding recognition , first , for the right to self - rule before proceeding any further .","But last April , the rebels abruptly pulled out of negotiations demanding recognition , first , for the right to self - rule before proceeding any further ."
1429,'s,'s,PART,,,,,,,0,"[""'"", 's']","[1005, 1055]",4,5,Genitive Case,kumar ##at ##ung ##a ' s india tour preceded a three - day visit to sri lanka by norwegian foreign minister jan petersen in a new bid to revive the peace talks that were supposed to follow a ceasefire that oslo successfully broker ##ed in february 2002 .,Kumaratunga 's India tour preceded a three - day visit to Sri Lanka by Norwegian Foreign Minister Jan Petersen in a new bid to revive the peace talks that were supposed to follow a ceasefire that Oslo successfully brokered in February 2002 .
1472,seems,seem,VERB,,Sing,3,Pres,,,1,['seems'],[3849],4,4,Third-Person Present Tense Verb,"colombo , too , seems to be in an intra ##ctable position .","Colombo , too , seems to be in an intractable position ."
1484,differences,difference,NOUN,,Plur,,,,,1,['differences'],[5966],2,2,Plural Noun,"however , differences between india and lt ##te soon surfaced and led to clashes between tiger guerrillas and the indian peace keeping force .","However , differences between India and LTTE soon surfaced and led to clashes between Tiger guerrillas and the Indian peace keeping force ."
1507,Tamils,tamil,NOUN,,Plur,,,,,1,"['tamil', '##s']","[6008, 2015]",1,2,Plural Noun,""" tamil ##s feel that the proposed defense agreement between india and sri lanka would encourage sin ##hala rulers to prepare for another war abandoning the current peace process , "" tna member of parliament p sit ##ham ##para ##nath ##an was quoted as saying in a statement .",""" Tamils feel that the proposed defense agreement between India and Sri Lanka would encourage Sinhala rulers to prepare for another war abandoning the current peace process , "" TNA member of parliament P Sithamparanathan was quoted as saying in a statement ."
1593,visits,visit,NOUN,,Plur,,,,,1,['visits'],[7879],4,4,Plural Noun,"she added that recent visits to the island by india ' s top military brass including army chief general ni ##rma ##l chan ##der vi ##j have "" caused apprehension among tamil ##s that preparations are under way for another war in the island "" .","She added that recent visits to the island by India 's top military brass including army chief General Nirmal Chander Vij have "" caused apprehension among Tamils that preparations are under way for another war in the island "" ."
1633,sentiments,sentiment,NOUN,,Plur,,,,,1,['sentiments'],[23541],34,34,Plural Noun,"but ka ##lka ##t pointed out that india would be ill - advised to be involved again , mil ##ita ##rily , with sri lanka if only because it still had to consider the sentiments of 45 million ethnic tamil ##s in the indian state of tamil nadu - separated from sri lanka ' s ja ##ff ##na peninsula by the narrow pal ##k straits .","But Kalkat pointed out that India would be ill - advised to be involved again , militarily , with Sri Lanka if only because it still had to consider the sentiments of 45 million ethnic Tamils in the Indian state of Tamil Nadu - separated from Sri Lanka 's Jaffna peninsula by the narrow Palk Straits ."
1747,circumstances,circumstance,NOUN,,Plur,,,,,1,['circumstances'],[6214],10,10,Plural Noun,"the best option , now , under the present difficult circumstances is for colombo to do its own dirty work , although new delhi can always be counted on to render good neighbor ##ly help because of the shared belief that religion , ethnicity and language can not be the basis for secession .","The best option , now , under the present difficult circumstances is for Colombo to do its own dirty work , although New Delhi can always be counted on to render good neighborly help because of the shared belief that religion , ethnicity and language can not be the basis for secession ."
1853,conferees,conferee,NOUN,,Plur,,,,,1,"['con', '##fer', '##ees']","[9530, 7512, 10285]",28,30,Plural Noun,"that india is not yugoslavia and that the "" foreigner - led "" indian national congress can least afford to ignore indian nationalism , has not struck the con ##fer ##ees , among whom have been several indian "" scholars "" and "" analysts "" ready to say and end ##ors ##e anything for the sake of a free trip to new york or vienna .","That India is not Yugoslavia and that the "" foreigner - led "" Indian National Congress can least afford to ignore Indian nationalism , has not struck the conferees , among whom have been several Indian "" scholars "" and "" analysts "" ready to say and endorse anything for the sake of a free trip to New York or Vienna ."
1915,for,for,ADP,,,,,,,0,['for'],[2005],2,2,Causal-Final Case,"the reason for this is that india is emerging as an alternative investment destination to china , hence the favor that the generals in islamabad do to their trust ##y supplier of nu ##kes and missiles by creating a scare about war involving india when in fact the real flash ##points are the taiwan straits and north korea .","The reason for this is that India is emerging as an alternative investment destination to China , hence the favor that the generals in Islamabad do to their trusty supplier of nukes and missiles by creating a scare about war involving India when in fact the real flashpoints are the Taiwan Straits and North Korea ."
1971,for,for,ADP,,,,,,,0,['for'],[2005],1,1,Causal-Final Case,"unfortunately for those eager to indefinitely carry on with the lucrative business of conflict resolution in south asia , per ##vez mu ##sha ##rra ##f has now called colin powell ' s bluff , challenging him to deliver on his frequent statements implying that the indians jump to his commands .","Unfortunately for those eager to indefinitely carry on with the lucrative business of conflict resolution in South Asia , Pervez Musharraf has now called Colin Powell 's bluff , challenging him to deliver on his frequent statements implying that the Indians jump to his commands ."
2017,for,for,ADP,,,,,,,0,['for'],[2005],3,3,Causal-Final Case,"before you fall for dem ##s ’ spin , here are the facts","Before you fall for Dems ’ spin , here are the facts"
2029,years,year,NOUN,,Plur,,,,,1,['years'],[2086],7,7,Plural Noun,news coverage of the president ’ s years in the guard has tended to focus on one brief portion of that time — to the exclusion of virtually everything else .,News coverage of the president ’s years in the Guard has tended to focus on one brief portion of that time — to the exclusion of virtually everything else .
2059,stands,stand,VERB,,Sing,3,Pres,,,1,['stands'],[4832],7,7,Third-Person Present Tense Verb,a 1970 evaluation said bush “ clearly stands out as a top notch fighter interceptor pilot ” and was “ a natural leader whom his contemporaries look to for leadership . ”,A 1970 evaluation said Bush “ clearly stands out as a top notch fighter interceptor pilot ” and was “ a natural leader whom his contemporaries look to for leadership . ”
2091,Voters,voter,NOUN,,Plur,,,,,1,['voters'],[7206],0,0,Plural Noun,voters are perfectly able to decide whether it ’ s important or not in november .,Voters are perfectly able to decide whether it ’s important or not in November .
2106,blames,blame,VERB,,Sing,3,Pres,,,1,"['blame', '##s']","[7499, 2015]",3,4,Third-Person Present Tense Verb,"the kerry camp blame ##s bush for the swift boat veterans ’ attack , but anyone who has spent much time talking to the swift ##ies gets the sense that they are doing it entirely for their own reasons .","The Kerry camp blames Bush for the Swift boat veterans ’ attack , but anyone who has spent much time talking to the Swifties gets the sense that they are doing it entirely for their own reasons ."
2182,veterans,veteran,NOUN,,Plur,,,,,1,['veterans'],[8244],7,7,Plural Noun,"in april — before the swift boat veterans had said a word — kerry said bush “ has yet to explain to america whether or not , and tell the truth , about whether he showed up for duty . ”","In April — before the Swift boat veterans had said a word — Kerry said Bush “ has yet to explain to America whether or not , and tell the truth , about whether he showed up for duty . ”"
2264,measures,measure,NOUN,,Plur,,,,,1,['measures'],[5761],6,6,Plural Noun,"the interim government has promised security measures that would reduce the violence on the day of elections , but i fail to see how they will be able to protect all 5 , 000 ( or so ) ballot ##ing centres .","The interim government has promised security measures that would reduce the violence on the day of elections , but I fail to see how they will be able to protect all 5,000 ( or so ) balloting centres ."
2342,lists,list,NOUN,,Plur,,,,,1,['lists'],[7201],11,11,Plural Noun,"now that the picture is clear , the two main competing lists seem to be the united iraqi coalition list and alla ##wi ' s al - iraqi ##ya list .","Now that the picture is clear , the two main competing lists seem to be the United Iraqi Coalition list and Allawi 's Al - Iraqiya list ."
